id,part,verse,in_doctrine,in_life_of_oyasama,en,ro,jp_1,jp_2
380,4,110,,,"Whatever pains, sufferings, tumors, fevers, or looseness of the bowels: all are from dust.",dono yona itami nayami mo dekemono ya   netsu mo kudari mo mina hokori ya de,どのよふないたみなやみもでけものや,ねつもくだりもみなほこりやで
381,4,111,,,Not since I began this world have I taught everything to those in high places.,kono yo o hajimete karani nanimo kamo   kami e oshieta koto wa arumai,このよふを初てからになにもかも,上ゑをしへた事ハあるまい
382,4,112,,,"This time, if I should inform those in high places about the truth of any and all matters,",konotabi wa nanika yorozu o kami taru e   shirashite oita koto de aru nara,このたびハなにかよろづを上たるゑ,しらしてをいた事であるなら
383,4,113,,,"Then, some among them may ponder. And if they all gather and speak to one another,",sorekara wa naka niwa shiyan suru mo aro   mina yoriyote hanashi shita nara,それからハなかにハしやんするもあろ,みなよりよふてはなししたなら
384,4,114,,,Some among them will understand and truly feel hopeful over the teachings.,sono naka ni shinjitsu kokoro tanomoshii   omote shiyan o suru mono mo aru,そのなかにしんぢつ心たのもしい,をもてしやんをするものもある
385,4,115,,,"When this path reaches through to the high places, God will reveal free and unlimited workings at once.",kono michi o kami e torita koto naraba   Kami no juyo suguni arawasu,このみちを上ゑとふりた事ならば,神のぢうよふすぐにあらわす
386,4,116,,,"I have not yet shown you any of the free and unlimited workings of God, who began this world.",kono yo o hajimeta Kami no juyo o   misetaru koto wa sarani nai node,このよふを初た神のぢうよふを,みせたる事ハさらにないので
387,4,117,,,"In everything, as long as you know nothing, you remain as you are. But if I let you know of God's free and unlimited workings,",nani nitemo shiran aida wa sono mama ya   Kami no juyo shirashitaru nara,なにゝてもしらんあいだハそのまゝや,神のぢうよふしらしたるなら
388,4,118,,,"On hearing of it, all of you in the world must ponder. Any and all matters are according to the mind.",kore kiite mina ichiretsu wa shiyan seyo   nanika yorozu wa kokoro shidai ya,これきいてみな一れつわしやんせよ,なにかよろつハ心しだいや
389,4,119,,,"Today, nothing can be seen, but be watchful! In the sixth month, everything will begin to appear.",kyonohi wa nani ga mieru ya nai keredo   roku gatsu o miyo mina dekakeru de,けふの日ハなにがみへるやないけれど,六月をみよみなでかけるで
390,4,120,,,"Until now, the high mountains have been boastful while the low valleys withered.",imamade wa takai yama ya to yute iru   tanisoko nitewa shiken bakari o,いまゝでハ高い山やとゆうている,たにそこにてハしけんばかりを
391,4,121,,,"From now on, I shall teach both the high mountains and the low valleys about the beginnings of origin.",korekara wa takayama nitemo tanisoko mo   moto hajimari o yute kikasuru,これからわ高山にてもたにそこも,もとはじまりをゆうてきかする
392,4,122,,1,The beginning of this universe was a muddy ocean. Therein were only loaches.,kono yo no hajimari dashi wa doro no umi   sono naka yori mo dojo bakari ya,このよふのはぢまりだしハとろのうみ,そのなかよりもどちよばかりや
393,4,123,,1,What do you think these loaches were? They were the very seeds of human beings.,kono dojo nanino koto ya to omote iru   kore ningen no tane de aru zo ya,このどぢよなにの事やとをもている,これにんけんのたねであるそや
394,4,124,,1,"God drew them up and consumed them all, and through providence brought them up into human beings step by step.",kono mono o Kami ga hikiage kute shimote   dandan shugo ningen to nashi,このものを神がひきあけくてしもて,だん／＼しゆごふにんけんとなし
395,4,125,,1,"From that time on, God's providence has been by no means an easy matter.",soreyori mo Kami no shugo to yu mono wa   nami taitei na koto de nai zo ya,それよりも神のしゆことゆうものわ,なみたいていな事でないぞや
396,4,126,,1,Do not think of this talk as being trivial. I desire to save all people in the world.,kono hanashi chotto no koto ya to omouna yo   sekai ichiretsu tasuketai kara,このはなし一寸の事やとをもうなよ,せかい一れつたすけたいから
397,4,127,,,Know that the mind of God is truly filled with deep concerns for you day after day.,nichinichi ni Kami no kokoro no shinjitsu wa   fukai omowaku aru to omoe yo,にち／＼に神の心のしんぢつわ,ふかいをもわくあるとをもへよ
398,4,128,,,"Until now, to God's regret, Nihon has been dominated, obeying those of Kara.",imamade wa nihon ga kara ni shitagote   mamani shirareta Kami no zannen,いまゝでハにほんかからにしたごふて,まゝにしられた神のざんねん
399,4,129,,,"Watch the workings of God given in return! No one will be able to imitate Me, whoever one may be.",kono kayashi Kami no hataraki kore o miyo   ikana mono demo mane wa dekemai,このかやし神のはたらきこれをみよ,いかなものでもまねわでけまい
400,4,130,,,"No matter how strong they may be, if God should withdraw, they will be powerless.",ika hodono goteki taru to yuta tote   Kami ga shirizoku kore kanaimai,いかほどのごふてきたるとゆうたとて,神がしりぞくこれかないまい
401,4,131,,,It is the same as this for everyone in all matters. Know that God will work freely and unlimitedly.,nani nitemo mina ichiretsu wa kono dori   Kami ga juyo suru to omoe yo,なにゝてもみな一れつハこのどふり,神がぢうよふするとをもゑよ
402,4,132,,,"Ponder well! No matter how young, old, or weak you may be, I shall give you My free and unlimited workings according to your mind.",shiyan seyo wakai toshiyori yowaki demo   kokoro shidai ni ikana juyo,しやんせよハかいとしよりよハきでも,心しだいにいかなぢうよふ
403,4,133,,,"Even until now, though you have lived in the same way, none of you has known of God's free and unlimited workings.",imamade mo onaji kurashite itaru tomo   Kami no juyo shirita mono nashi,いまゝでもをなぢくらしていたるとも,神のぢうよふしりたものなし
404,4,134,,,"From now on, I shall teach you about any and all matters. Make certain you make no errors of the mind.",korekara wa yorozu no koto o mina tokude   kokoro chigai no nai yoni seyo,これからハよろづの事をみなとくで,心ちがいのないよふにせよ
405,5,1,,,"Until now, there has been much talk of rebirth as oxen or horses, but there has been no one who knows his past or future.",imamade wa gyuba to yu wa mama aredo   ato saki shireta koto wa arumai,いまゝでハぎうばとゆうハまゝあれど,あとさきしれた事ハあるまい
406,5,2,,,"This time, I shall make your future known in this life: look at the disorder of the body!",konotabi wa saki naru koto o kono yo kara   shirashite oku de mi ni sawari miyo,このたびハさきなる事を此よから,しらしてをくでみにさハりみよ
407,5,3,,,"In this world, however much you may be concerned about yourself, you are helpless against the anger of God.",kono yo wa ika hodo waga mi omotemo   Kami no rippuku kore wa kanawan,このよふハいかほどハがみをもふても,神のりいふくこれハかなハん
408,5,4,1,,None of you needs self-centered concern. God will distinguish between each of you.,meme ni waga mi shiyan wa iran mono   Kami ga sorezore miwake suru zo ya,めへ／＼にハがみしやんハいらんもの,神がそれ／＼みわけするぞや
409,5,5,,,"Among those living in the same residence, know that there are both god and buddha.",hito yashiki onaji kurashite iru uchi ni   Kami mo hotoke mo aru to omoe yo,一やしきをなじくらしているうちに,神もほとけもあるとをもへよ
410,5,6,,,"If you see this, be convinced, whoever you may be: God will distinguish between good and evil.",kore o mite ikana mono demo tokushin se   zen to aku to o wakete miseru de,これをみていかなものでもとくしんせ,善とあくとをわけてみせるで
411,5,7,,,"Ponder over this talk, all of you in the world. There is no mind the same as another.",kono hanashi mina ichiretsu wa shiyan seyo   onaji kokoro wa sarani arumai,このはなしみな一れつハしやんせよ,をなじ心わさらにあるまい
412,5,8,,,"Even between parent and child, husband and wife, and brothers and sisters: their minds all differ from one another.",oyako demo fufu no naka mo kyodai mo   mina meme ni kokoro chigau de,をやこでもふう／＼のなかもきよたいも,みなめへ／＼に心ちがうで
413,5,9,,,"Indicating no one in the world in particular, I say to you: dust in the mind causes disorders of the body.",sekaiju doko no mono towa yuwan de na   kokoro no hokori mi ni sawari tsuku,せかいぢうどこのものとハゆハんでな,心のほこりみにさハりつく
414,5,10,,,Ponder over your sufferings of the body and then ponder the mind that leans on God.,minouchi no nayamu koto oba shiyan shite   Kami ni motareru kokoro shiyan se,みのうちのなやむ事をばしやんして,神にもたれる心しやんせ
415,5,11,,,"It does not matter how difficult your condition may be, for God desires to reveal free and unlimited workings quickly.",dono yona mutsukashi koto to yuta tote   Kami no juyo hayaku misetai,どのよふなむつかし事とゆうたとて,神のぢうよふはやくみせたい
416,5,12,,,"Until now, there has been no one who knows the truth of God's free and unlimited workings.",imamade wa Kami no juyo shinjitsu o   shiritaru mono wa sarani nai node,いまゝでハ神のぢうよふしんぢつを,しりたるものさらにないので
417,5,13,,,"From now on, no matter how serious your illness may be, nothing is incurable. It depends on your mind.",korekara wa ikana mutsukashi yamai demo   kokoro shidai ni naorande nashi,これからハいかなむつかしやまいでも,心したいになをらんでなし
418,5,14,,,"If God accepts your mind of sincerity, I shall work freely and unlimitedly in any matter.",shinjitsu no kokoro o Kami ga uketoreba   ikana juyo shite miseru de na,しんぢつの心を神がうけとれば,いかなぢうよふしてみせるてな
419,5,15,,,"You close to Me, quickly become enlightened in this teaching of the truth of God.",kora hodono Kami no shinjitsu kono hanashi   soba naru mono wa hayaku satore yo,こらほどの神のしんぢつこのはなし,そばなるものハはやくさとれよ
420,5,16,,,"If you quickly become enlightened in this one matter, everything will proceed accordingly.",kore saika hayaku satori ga tsuita nara   nani ni tsuitemo mina kono dori,これさいかはやくさとりがついたなら,なにゝついてもみなこのどふり
421,5,17,,,"Until today, I have never hastened you in any way. Now, I hasten you toward the broad path.",kyomade wa nani yono koto mo sekane domo   mo sekikomu de okwan no michi,けふまでハなによの事もせかねとも,もふせきこむでをふくハんのみち
422,5,18,,,Never think this path is worldly common. It is the beginning of the Divine Record for eternity.,kono michi wa sekainami towa omouna yo   kore matsudai no Koki hajimari,このみちハせかいなみとハをもうなよ,これまつだいのこふきはぢまり
423,5,19,,,I do not say where the performers will be found. All will come because of disorders of the body.,kono ninju doko ni aru towa yuwan de na   minouchi sawari mina kuru de aro,このにんぢうとこにあるとハゆハんでな,みのうちさハりみなくるであろ
424,5,20,,,"These disorders are from My guidance, admonition, or anger. Ponder, each of you.",kono sawari tebiki iken mo rippuku mo   mina meme ni shiyan shite miyo,このさハりてびきいけんもりいふくも,みなめへ／＼にしやんしてみよ
425,5,21,,,What are your thoughts on hearing this talk? I appeal to you repeatedly out of My deep love for you.,kono hanashi nanto omote kiite iru   kawai amarite kudoku koto nari,このはなしなんとをもふてきいている,かハいあまりてくどく事なり
426,5,22,,,"However I may express My admonition or anger, I shall never say that you will not be saved.",dono yoni iken rippuku yuta tote   kore tasuken to sarani yuwan de,どのよふにいけんりいふくゆうたとて,これたすけんとさらにゆハんで
427,5,23,,,"Think of you humans admonishing your children. The anger, too, comes from love.",ningen no waga ko no iken omote miyo   hara no tatsu no mo kawai yue kara,にんけんのハがこのいけんをもてみよ,はらのたつのもかハいゆへから
428,5,24,1,,Ponder and come follow Me with firm resolve. There is a path of hope in the future.,shiyan shite kokoro sadamete tsuitekoi   sue wa tanomoshi michi ga aru zo ya,しやんして心さためてついてこい,すゑハたのもしみちがあるぞや
429,5,25,,,"Until now, because the day had not yet come, I have overlooked your mistaken minds.",imamade wa kokoro chigai wa arita tote   hi ga kitarande miyurushite ita,いまゝでハ心ちがいわありたとて,ひがきたらんてみゆるしていた
430,5,26,,1,"This time, by all means, I shall sweep clean your innermost heart. Be forewarned!",konotabi wa nandemo kademo mune no uchi   soji o suru de mina shochi seyo,このたびはなんでもかでもむねのうち,そうちをするでみなしよちせよ
431,5,27,,1,The reason for this sweeping of your innermost heart is that the intent of God is deep.,mune no uchi soji o suru to yu no mo na   Kami no omowaku fukaku aru kara,むねのうちそふぢをするとゆうのもな,神のをもハくふかくあるから
432,5,28,,1,"Unless the sweeping is thoroughly accomplished, you will not understand the truth of My heart.",kono soji sukiyaka shitate sen koto ni   mune no shinjitsu wakari nai kara,このそふぢすきやかしたてせん事に,むねのしんぢつわかりないから
433,5,29,,1,"When you have truly come to understand My mind, I shall teach you the hand movements of the beginning of this world.",kono kokoro shin kara wakari tsuita nara   kono yo hajimari te o tsukeru nari,この心しんからわかりついたなら,このよはぢまりてをつけるなり
434,5,30,,,Take no short cuts. Have no greed or arrogance. Come out to the single and straight main path.,chikamichi mo yoku mo koman nai yoni   tada hitosuji no honmichi ni deyo,ちかみちもよくもこふまんないように,たゞ一すぢのほんみちにでよ
435,5,31,,,"When you have come onto this path, this will be the Divine Record forever in Nihon.",kono michi ni tsuitaru naraba itsu made mo   kore nippon no Koki naru no ya,このみちについたるならばいつまても,これにいほんのこふきなるのや
436,5,32,,,"When the Divine Record is made in Nihon, I shall by all means manage Kara as I please.",nihon nimo Koki ga deketa koto naraba   nandemo kara o mamani suru nari,にほんにもこふきがでけた事ならば,なんでもからをまゝにするなり
437,5,33,,,I have not spoken yet about the truth of those things that came after I began this world.,kono yo o hajimete kara no shinjitsu o   mada imamade wa yuta koto nashi,このよふをはぢめてからのしんぢつを,またいまゝでハゆうた事なし
438,5,34,,,"This talk will be difficult to understand, but if it is left untold, no one will know.",kono hanashi mutsukashi koto de aru keredo   yuwazu ni ireba tare mo shiran de,このはなしむつかし事であるけれど,ゆハずにいればたれもしらんで
439,5,35,,,"Step by step, I shall tell you of any and all matters. Calm your mind and listen closely!",dandan to dono yona koto mo yute kikasu   kokoro shizumete shikato kiku nari,たん／＼とどのよな事もゆてきかす,心しずめてしかときくなり
440,5,36,,,"Until now, there has been talk about various magical rites. From now on, they shall have no effect.",imanade wa ika naru ho to yuta tote   mo korekara wa ho wa kikande,いまゝでハいかなるほふとゆうたとて,もふこれからハほふハきかんで
441,5,37,,,"In the past, such magical rites have been taught to the branches, but watch the future.",koremade wa edasaki nitewa ho nazo to   oshiete aredo saki o mite iyo,これまてハゑださきにてわほふなぞと,をしへてあれどさきをみていよ
442,5,38,,,"Nihon has known nothing until now, but look forward to the future path.",nihon niwa imamade nanimo shirai demo   korekara saki no michi o tanoshume,にほんにハいまゝでなにもしらいでも,これからさきのみちをたのしゆめ
443,5,39,,,"About magical rites: do not wonder who is making them effective. They are worked by God, who began this world.",ho ya tote tare ga suru towa omouna yo   kono yo hajimeta Kami no nasu koto,ほふやとてたれがするとハをもうなよ,このよ初た神のなす事
444,5,40,,,"However difficult matters may be, if only your sincerity is accepted by God...",dono yona mutsukashi koto to yuta tote   Kami ga shinjitsu uketorita nara,どのよふなむつかし事とゆうたとて,神がしんちつうけとりたなら
445,5,41,,,"Until now, there has been talk about Kara and Nihon, but from now on there will only be Nihon.",imamade wa kara ya nihon to yutaredo   korekara saki wa nihon bakari ya,いまゝでハからやにほんとゆうたれど,これからさきハにほんばかりや
446,5,42,,,"The branches may look big, but they are weak and break when handled. Watch the future.",edasaki wa oki ni miete akan mono   kamaeba oreru saki o mite iyo,ゑださきハをふきにみへてあかんもの,かまへばをれるさきをみていよ
447,5,43,,,"The origin may seem small, but the root is great. In all things, know the origin!",moto naru wa chiisai yo de ne ga erai   dono yona koto mo moto o shiru nari,もとなるハちいさいよふでねがえらい,とのよな事も元をしるなり
448,5,44,,,Do not think that incantations or magical arts are great. The mind's sincerity is the true art.,jitsu ya tote ho ga erai to omouna yo   kokoro no makoto kore ga shinjitsu,ぢつやとてほふがへらいとをもうなよ,こゝろのまことこれがしんぢつ
449,5,45,,,"As you humans are shallow, you say that all marvels are magic.",ningen wa azanai mono de aru karani   mezurashi koto o ho nazo to yu,にんけんハあざないものであるからに,めづらし事をほふなぞとゆう
450,5,46,,,"Even until now, though God is openly revealed, there is yet no one who knows the truth.",imamade wa Kami ga araware detaru tote   mada shinjitsu o shirita mono nashi,いまゝでハ神があらハれでたるとて,まだしんぢつをしりたものなし
451,5,47,,,"Hereafter, when I have taught you the truth of all things,",konosaki wa dono yona koto mo shinjitsu o   oshiete oita koto de aru nara,このさきハどのよな事もしんじつを,をしへてをいた事であるなら
452,5,48,,,"Then, I shall show you God's free and unlimited workings in all matters.",sorekara wa Kami no hataraki nanimo kamo   juyojizai o shite miseru de na,それからハ神のはたらきなにもかも,ぢうよじざいをしてみせるでな
453,5,49,,,"When God in Truth begins to work, the minds of all in the world will be purified.",shinjitsu no Kami no hataraki shikaketara   sekai ichiretsu kokoro sumikiru,しんぢつの神のはたらきしかけたら,せかい一れつ心すみきる
454,5,50,,,What are your thoughts concerning My workings? I shall give returns when I accept your minds.,hataraki mo ika naru koto to omou kana   kokoro uketori shidai kayashi o,はたらきもいかなる事とをもうかな,心うけとりしだいかやしを
455,5,51,,,What do you think these returns are about? They will reach you though you be a thousand leagues away.,kono kayashi nanino koto ya to omou kana   michinori sen ri hedate aritemo,このかやしなにの事やとをもうかな,みちのりせんりへだてありても
456,5,52,,,"Whatever you may say or think, I shall give returns as soon as I accept your minds.",kono koto wa nani o yutemo omotemo   uketori shidai suguni kayashi o,この事ハなにをゆうてもをもふても,うけとりしだいすぐにかやしを
457,5,53,,,Do not wonder what these returns are about. I shall give returns for both good and evil.,kono kayashi nanno koto ya to omouna yo   zen aku tomoni mina kayasu de na,このかやしなんの事やとをもうなよ,せんあくともにみなかやすてな
458,5,54,,,"Whether you speak good or think evil, I shall give returns at once as you deserve.",yoki koto o yutemo ashiki omotemo   sono mama suguni kayasu koto nari,よき事をゆうてもあしきをもふても,そのまゝすくにかやす事なり
459,5,55,,,"If you begin to see this, My purification will reach any and everyone in the whole world.",kono koto o miekita naraba ichiretsu wa   donna mono demo mina sumiwataru,この事をみへきたならば一れつわ,どんなものでもみなすみわたる
460,5,56,,,"Today, though nothing is seen, look toward the eighth month. Then everything will be seen.",kyonohi wa nani ga mieru ya nai keredo   hachi gatsu o miyo mina mieru de na,けふの日ハなにがみへるやないけれど,八月をみよみなみへるでな
461,5,57,,1,"Perhaps you cannot foresee what is going to appear. From the high mountains, a broad path will open.",mieru no mo nanino koto yara shiremai na   takai yama kara okwan no michi,みへるのもなにの事やらしれまいな,高い山からをふくハんのみち
462,5,58,,1,"I have been preparing to open this path, but those of you close to Me know nothing of it.",kono michi o tsukeyo tote ni shikoshirae   soba naru mono wa nanimo shirazu ni,このみちをつけよふとてにしこしらへ,そばなるものハなにもしらすに
463,5,59,,1,"Those who come here to summon or to investigate, come because it is God's intent.",kono toko e yobi ni kuru no mo detekuru mo   Kami no omowaku aru kara no koto,このとこへよびにくるのもでゝくるも,神のをもハくあるからの事
464,5,60,,,"Knowing nothing about this, you close to Me think of it only in worldly terms.",sono koto o nanimo shirazu ni soba naru wa   sekainami naru koto o omote,その事をなにもしらすにそばなるハ,せかいなみなる事をふもをて
465,5,61,,,Do not think of anything in worldly terms. There is a new and marvelous path for you.,nani nitemo sekainami towa omouna yo   nanika mezurashi michi ga aru zo ya,なにゝてもせかいなみとハをもうなよ,なにかめつらしみちがあるぞや
466,5,62,,,"Though years have passed since the beginning of this world, there is yet no one who knows the truth.",dandan to kono yo hajimete hi wa tatedo   tare ka shinjitsu shirita mono nashi,だん／＼とこのよはぢめてひハたてど,たれかしんぢつしりたものなし
467,5,63,,,"No matter how the mind of God hastens, the minds of all of you are yet inattentive.",ika hodoni Kami no kokoro wa seta tote   mina no kokoro wa mada ukkari to,いかほどに神の心わせゑたとて,みなの心ハまたうゝかりと
468,5,64,,,"Quickly, try the pondering and then hasten. Why are you not preparing to dig up the root?",hayabaya to shiyan shite mite sekikome yo   ne horu moyo nande shiteden,はや／＼としやんしてみてせきこめよ,ねへほるもよふなんでしてでん
469,5,65,,,"There is no one who knows the way to dig up the root, the truth of this world.",kono yo no shinjitsu ne no horikata o   shiritaru mono wa sarani nai node,このよふのしんぢつねへのほりかたを,しりたるものハさらにないので
470,5,66,,,"If you have but truly dug up this root, this path will become truly promising.",kono ne o shinjitsu horita koto naraba   makoto tanomoshi michi ni naru no ni,このねへをしんぢつほりた事ならば,ま事たのもしみちになるのに
471,5,67,,,"When you have passed through this path, completing the digging, both the high and the low will be spirited.",kono michi o horikiri tori nuketa nara   kami shimo tomoni kokoro isamu ni,このみちをほりきりとふりぬけたなら,上下ともに心いさむに
472,5,68,,,"From now on, I shall make every effort solely for the preparations to make everyone in the world spirited.",korekara wa nandemo sekai ichiretsu o   isameru moyo bakari suru zo ya,これからハなんでもせかい一れつを,いさめるもよふばかりするそや
473,5,69,,,I shall teach you step by step so that there will be nothing unknown in Nihon.,dandan to nani goto nitemo nihon niwa   shiran koto owa nai to yu yoni,だん／＼となに事にてもにほんにハ,しらん事をわないとゆうよに
474,5,70,,,I desire to teach the whole world about all matters. The intention of God is truly deep.,nanimo kamo sekaiju e oshietai   Kami no omowaku fukaku aru no ni,なにもかもせかいぢうゝへをしへたい,神のをもわくふかくあるのに
475,5,71,,,"Unaware of this, all the world thinks My teachings are somehow dangerous.",sore shirazu sekaiju wa ichiretsu ni   nando abunaki yoni omote,それしらすせかいぢうゝハ一れつに,なんどあぶなきよふにをもふて
