id,part,verse,in_doctrine,in_life_of_oyasama,en,ro,jp_1,jp_2
766,8,29,,,I do not speak of things already seen or of things that already exist.,imamade ni mietaru koto ya aru koto wa   sonna koto owa yu de nai zo ya,いまゝてにみへたる事やある事わ,そんな事をハゆうでないそや
767,8,30,,,I shall teach you only of things that have not existed before and bring true salvation.,koremade ni nai koto bakari yute kikashi   shinjitsu yori no tasuke suru zo ya,これまてにない事ばかりゆてきかし,しんぢつよりのたすけするそや
768,8,31,,,What do you think this salvation is about? I am preparing the amulet to protect you from smallpox.,kono tasuke doyu koto ni omou kana   hoso sen yono Mamori koshirae,このたすけどふゆう事にをもうかな,ほふそせんよのまむりこしらゑ
769,8,32,,,"Another salvation: My free and unlimited workings for the time of childbirth, either to delay or to quicken.",mata tasuke obiya juyo itsu nari to   nobashi nari tomo hayame nari tomo,またたすけをひやぢうよふいつなりと,のばしなりともはやめなりとも
770,8,33,,,About these free and unlimited workings of which I speak: do not think of them as being trivial.,kora hodono juyojizai o yu no mo na   yoi naru koto to sarani omouna,こらほとのぢうよじさいをゆうのもな,よいなる事とさらにをもうな
771,8,34,,,"Though Tsukihi is doing the utmost, everyone in the world continues to be ordinary.",Tsukihi niwa taite kokoro wa tsukuse domo   sekaiju wa mada sekainami,月日にハたいて心ハつくせとも,せかいぢううハまだせかいなみ
772,8,35,,,I must have you know My true intent in beginning this world.,kono yo o hajime dashitaru honshin o   yute kikasan koto ni oite wa,このよふをはじめたしたるほんしんを,ゆうてきかさん事にをいてわ
773,8,36,,,"This place, the place for the Service, is the very place where I began human beings.",kono tokoro Tsutome basho wa ningen o   hajime dashitaru tokoro naru zo ya,このところつとめばしよハにんけんを,はじめだしたるところなるそや
774,8,37,1,,"This Parent, who began human beings, lives. This is the truth.",ningen o hajime dashitaru kono Oya wa   zonmee de iru kore ga makoto ya,にんけんをはじめだしたるこのをやハ,そんめゑでいるこれがまことや
775,8,38,,,There is perhaps no one anywhere who believes this talk to be the truth.,kono hanashi kore o makoto ni omou mono   doko no mono demo sarani arumai,このはなしこれをまことにをもうもの,どこのものでもさらにあるまい
776,8,39,,,"Though I speak in this way about things which do not exist, it is all the real truth.",kono yona nai koto bakari yu no wa na   kore ga shinjitsu mina makoto ya de,このよふなない事ばかりゆうのハな,これがしんぢつみなまことやで
777,8,40,,,"Even until now, when I began this world which did not exist, I began by teaching things unknown.",imamade mo nai sekai oba hajimeta wa   shiranu koto oba oshie hajimete,いまゝでもないせかいをばはじめたハ,しらぬ事をばをしゑはじめて
778,8,41,,,"This time also, I begin to teach again, speaking only of things which do not exist and things unknown.",konotabi mo mata nai koto ya shiranu koto   bakari yuute mata oshiekake,このたびもまたない事や知らぬ事,ばかりゆううてまたをしへかけ
779,8,42,,,This is the intention of Tsukihi: to teach everything which no one has ever known.,dono yona mono demo shiranu koto bakari   kore o oshieru Tsukihi omowaku,どのよふなものでもしらぬ事ばかり,これをふしへる月日をもわく
780,8,43,,,"By teaching everything solely about the unknown step by step, Tsukihi will save the world.",Tsukihi niwa dandan shiranu koto bakari   nanimo oshiete sekai tasukeru,月日にハたん／＼しらぬ事ばかり,なにもをしへてせかいたすける
781,8,44,,,"So great is Tsukihi's concern, but those in the world are aware of nothing.",kora hodoni omou Tsukihi no shinpai o   sekai no mono wa nanimo shirazu ni,こらほどにをもう月日のしんばいを,せかいのものハなにもしらずに
782,13,71,1,,"If only your mind is truly accepted by Tsukihi, you will be assured of any salvation whatever.",kokoro sai Tsukini shinjitsu uketoreba   donna tasuke mo mina ukeyau de,心さい月日しんぢつうけとれば,どんなたすけもみなうけやうで
783,8,46,,,Tsukihi assures you any and every salvation because your true Parent lives.,dono yona tasuke to yu mo shinjitsu no   Oya ga iru kara Tsukihi yu no ya,とのよふなたすけとゆうもしんちつの,をやがいるから月日ゆうのや
784,8,47,1,,"Because the Jiba of Origin and the causality of origin exist, Tsukihi works freely and unlimitedly.",kono Tsukihi moto naru Jiba ya moto naru no   innen aru de juyojizai o,この月日もとなるぢばや元なるの,いんねんあるでちうよぢざいを
785,8,48,1,,You may wonder why I repeat this teaching so persistently. It is the basis of My assurance of single-hearted salvation.,kono hanashi nande kono yoni kudoi nara   tasuke ichijo ukeyau no moto,このはなしなんでこのよにくどいなら,たすけ一ぢよううけやうのもと
786,8,49,,,"Wherever you may seek to find the origin, there will be no one who knows.",kono moto wa doko o tazunete mitaru tomo   shiritaru mono wa sarani arumai,このもとハとこをたづねてみたるとも,しりたるものハさらにあるまい
787,8,50,,,"So should it be, for this is the first time that Tsukihi has entered a body and speaks.",sono hazu ya Tsukihi tainai irikonde   hanashi suru no wa ima hajime ya de,そのはづや月日たいない入りこんで,はなしするのハいまはじめやで
788,8,51,1,,"To Tsukihi, who can see everything in this world, nothing is unknown.",kono sekai ichiretsu mieru Tsukihi nara   doko no koto demo shiranu koto nashi,このせかい一れつみゑる月日なら,とこの事でもしらぬ事なし
789,8,52,1,,"Watching each and everyone of you, Tsukihi will discern the good and evil.",Tsukihi yori mina sorezore to misadamete   zen to aku to o miwake suru zo ya,月日よりみなそれ／＼とみさだめて,善とあくとをみハけするぞや
790,8,53,,,"If you wonder why Tsukihi is so persistent, it is because I pity you when evil appears.",Tsukihi yori nande kono yoni kudoi nara   ashiki mieru ga kinodoku na kara,月日よりなんでこのよにくどいなら,あしきみへるがきのどくなから
791,8,54,,,"If your debts pile up step by step, a path of oxen and horses will finally appear.",dandan to on ga kasanari sono ue wa   gyuba to mieru michi ga aru kara,たん／＼とをんかかさなりそのゆへハ,きゆばいみへるみちがあるから
792,8,55,,,"But Tsukihi will save all of you, whoever you may be, if only your sincerity is accepted.",dono yona mono demo Tsukihi shinjitsu o   uketorita nara mina tasukeru de,とのよふなものでも月日しんぢつを,うけとりたならみなたすけるで
793,8,56,,,"Until now, no matter what I had told you, you have not been able to see anything.",imamade wa donna hanashi o shitaru tomo   nanimo mietaru koto wa nakeredo,いまゝでハどんなはなしをしたるとも,なにもみゑたる事ハなけれど
794,8,57,,,"Even until now, all things have already appeared, but you have not known their true origin.",koremade mo mina miekitaru koto naredo   honmoto naru o shiran koto kara,これまてもみなみへきたる事なれど,ほんもとなるをしらん事から
795,8,58,,,"Thunder, earthquakes, great winds, and floods: these are from the regret and anger of Tsukihi.",kaminari mo jishin okaze mizutsuki mo   kore wa Tsukihi no zanen rippuku,かみなりもぢしんをふかぜ水つきも,これわ月日のざねんりいふく
796,8,59,,,"Because no one has ever understood this matter, this time Tsukihi will tell you about them beforehand.",kono koto o imamade tare mo shiran kara   konotabi Tsukihi saki e shirasuru,この事をいまゝでたれもしらんから,このたび月日さきゑしらする
797,8,60,,,"To Tsukihi, each of you, one and all, is a child of Mine. I am filled with love for you.",Tsukihi niwa mina ichiretsu wa waga ko nari   kawai ippai omote iredomo,月日にハみな一れつハわが子なり,かハいゝばいをもていれとも
798,8,61,,,But the innermost heart of everyone of you is covered with piles of dust.,ichiretsu wa mina meme no mune no uchi   hokori ippai tsumori aru kara,一れつハみなめへ／＼のむねのうち,ほこりいゝばいつもりあるから
799,8,62,,,"Unless this dust is cleanly swept away, the deep concern of Tsukihi will be to naught.",kono hokori sukiyaka soji sen koto ni   Tsukihi ika hodo omotaru tote,このほこりすきやかそふぢせん事に,月日いかほどをもふたるとて
800,8,63,,,Tsukihi is anxious about your dreadful and dangerous course. Yet none of you is aware.,Tsukihi yori kowaki abunaki michisuji o   anjite iredo meme shirazu ni,月日よりこわきあふなきみちすじを,あんぢていれどめへ／＼しらすに
801,8,64,,,"On however high a place you may be, everyone is a child of Tsukihi.",dono yona takai tokoro to yuta tote   Tsukihi no ta ni mina waga ko ya de,とのよふなたかいところとゆうたとて,月日のたあにみなわがこやで
802,8,65,,,"Knowing nothing of it, you try to stop your Parent's work, even to take things away. What manner is this?",sore shirazu Oya no suru koto sashitomete   mata toriharote kore wa ikaga zo,それしらずをやのする事さしとめて,またとりはろてこれハいかゞぞ
803,8,66,,,"Though until now Tsukihi has never come out into the open no matter what occurred,",Tsukihi niwa imamade donna koto ya tote   araware detaru koto wa nakeredo,月日にハいまゝでどんな事やとて,あらわれでたる事わなけれど
804,8,67,,,"This time, unless your innermost heart is made thoroughly clear, the preparations to follow cannot be made.",konotabi wa mune no uchi yori sukiyaka ni   harasan koto ni ato no moyo o,このたびハむねのうちよりすきやかに,はらさん事にあとのもよふを
805,8,68,,,"Thereafter, I shall need only to proceed with the means to save all of you, whoever you may be.",kono ato wa dono yona mono mo ichiretsu ni   tasuketai to no shudan bakari o,このあとハとのよなものも一れつに,たすけたいとのしゆだんはかりを
806,8,69,,,"Hereafter, when I begin My work of single-hearted salvation, everyone of you will only be spirited.",konosaki wa tasuke ichijo ni kakaritara   dono yona mono mo isamu bakari ya,このさきハたすけ一ぢよにかゝりたら,どのよなものもいさむばかりや
807,8,70,,,Whatever Tsukihi has once said will never become false through all time.,nani goto mo Tsukihi ichido yuta koto   chigai so naru koto wa nai zo ya,なに事も月日一どふゆうた事,ちがいそふなる事わないぞや
808,8,71,,,"Even until now, I have taught you so tediously, yet there is no understanding in your minds.",imamade mo akudoi hodo mo toite aru   naredo kokoro ni wakari nai kara,いまゝてもあくどいほともといてある,なれと心にわかりないから
809,8,72,,,"Listen! You are mistaken in thinking of Me as being human, the same as you.",shikato kike onaji ningen naru yoni   omote iru no wa kore wa chigau de,しかときけをなじにんけんなるよふに,をもているのハこれハちがうで
810,8,73,,,"To begin teaching about all matters, one must be the Parent of Origin.",dono yona koto o oshiete kakaru no mo   moto naru Oya de nakuba ikan de,どのような事をふしへてかゝるのも,もとなるをやてなくばいかんで
811,8,74,,,"Even until now, in all the teachings I have given you, I began them by this truth.",imamade mo nani o oshiete kitaru no mo   mina kono dori hajime kaketa de,いまゝてもなにをふしへてきたるのも,みなこのどふりはじめかけたで
812,8,75,1,,"If there should be another parent who began human beings, go and seek to find where.",ningen o hajimeta Oya ga mo ichi nin   doko ni aru nara tazune ite miyo,にんけんをはじめたをやがも一にん,どこにあるならたつねいてみよ
813,8,76,,,"Though I speak in this way of unknown things step by step, it is the truth.",kono yona shiranu koto oba dandan to   yute iredomo kore ga makoto ya,このよふなしらぬ事をばだん／＼と,ゆうていれどもこれがまことや
814,8,77,,,"Day after day, teaching you of the unknown and of things yet to be is the pleasure of Tsukihi.",nichinichi ni shiranu koto o ya nai koto o   kore oshieru ga Tsukihi tanoshimi,にち／＼にしらぬ事をやない事を,これをしへるが月日たのしみ
815,8,78,,,You have heard of the Gift of Heaven to be given to the Parent of this world's human beginnings.,kono yo no ningen hajime Oya naru ni   ten no atae wa aru to kikedomo,このよふのにんけんはじめをやなるに,天のあたゑハあるときけども
816,8,79,,,You may not know what this talk is about. Tsukihi wishes to bestow the Food of Heaven.,kono hanashi nanino koto yara choto shiren   Tsukihi jikimotsu yaro to yu no ya,このはなしなにの事やら一寸しれん,月日ぢきもつやろとゆうのや
817,8,80,,,Further about this talk: place a flat vessel on the Kanrodai.,kono hanashi doyu koto de aro nara   Kanrodai ni hirabachi o nose,このはなしどふゆう事であろをなら,かんろふたいにひらばちをのせ
818,8,81,,1,"Hereafter, bodily disorders will appear here and there. Know that it is the care being given by Tsukihi.",konosaki wa atchi kotchi ni mi ni sawari   Tsukihi teiri o suru to omoe yo,このさきハあゝちこゝちにみにさハり,月日ひていりをするとをもゑよ
819,8,82,,1,"When you come, compare your disorder with this place. If the condition is the same, quickly begin the sweeping.",kitaru nara waga mi sawari to hikiyawase   onaji koto nara hayaku soji o,きたるならわがみさハりとひきやハせ,をなじ事ならはやくそふぢふ
820,8,83,,1,"Walk over where you have swept, and you will come to a standstill. There, the Kanrodai...",soji shita tokoro o aruki tachidomari   sono tokoro yori Kanrodai o,そふぢしたところをあるきたちとまり,そのところよりかんろふだいを
821,8,84,,,"When it is done, assemble the performers and quickly begin the Service. Your minds will be spirited.",shitaru nara soreyori Tsutome te o soroi   hayaku kakare yo kokoro isamu de,したるならそれよりつとめてをそろい,はやくかゝれよ心いさむで
822,8,85,,,"Indeed, wherever else you may seek it, it will never be found. It is the central pillar of Nihon.",kore bakari doko tazunetemo nai hodoni   kore nippon no shin no hashira ya,こればかりどこたづねてもないほどに,これにいほんのしんのはしらや
823,8,86,,,"If only this comes surely into being, there will be no one whoever to fear.",kore saika tashika miekita koto naraba   donna mono demo osoru mono nashi,これさいかたしかみへきた事ならば,とんなものでもをそるものなし
824,8,87,,,"In any case, unless you are able to see the proof of the truth, I cannot set out on My next preparations.",nani yu mo shinjitsu naru no shoko ga   mien koto niwa ato no moyo o,なにゆうもしんぢつなるのしよこふが,みゑん事にわあとのもよふを
825,8,88,,,"On however high a place you may be, I shall talk to you freely.",dono yona takai tokoro no mono ya tote   juyoshidai ni hanashi suru nari,とのよふな高いところのものやとて,ぢうよしだいにはなしするなり
826,9,1,,,"Until now, whatever I said, you thought it had come from the mind of a human being.",imamade wa nani o yutemo ningen no   kokoro no yoni omote itaredo,いまゝでハなにをゆうてもにんけんの,心のよふにをもていたれど
827,9,2,,,"This time, whatever I may say, never think that it comes from a human mind.",konotabi wa nani o yutemo ningen no   kokoro aru towa sarani omouna,このたびハなにをゆうてもにんけんの,心あるとハさらにをもうな
828,9,3,,,Please listen closely to whatever I say. Never is there mixed the least bit of a human mind.,dono yona koto demo shikato kiite kure   ningen gokoro sarani mazen de,どのよふな事でもしかときいてくれ,にんけん心さらにまぜんで
829,9,4,,,"Tsukihi is going to tell you clearly about all matters. Listen to Me, please.",Tsukihi yori dono yona koto mo shikkari to   yuikakeru de na kore kiite kure,月日よりどのよな事もしいかりと,ゆいかけるでなこれきいてくれ
830,9,5,,,I desire that the two persons received as shrines by Tsukihi each be given a separate room.,Tsukihi yori yashiro to naru o futari tomo   betsuma hedatete oite morotara,月日よりやしろとなるを二人とも,べつまへだてゝをいてもろたら
831,9,6,,,"Then, in whatever you pray, your salvation will be assured. Watch closely!",nani yu mo soreyori shikato ukeyote   tasuke suru zo ya shikato mite iyo,なにゆうもそれよりしかとうけよふて,たすけするぞやしかとみていよ
832,9,7,,,This is the basis by which any salvation will be assured hereafter.,konosaki wa dono yona tasuke suru no mo na   mina ukeyau no moto de aru kara,このさきハどのよなたすけするのもな,みなうけやうのもとであるから
833,9,8,,,"Do not disregard anything I say. Listen closely and comply with it, please.",dono yona koto o yutemo kesan yo   tashika kikisumi shochi shite kure,どのよふな事をゆうてもけさんよふ,たしかきゝすみしよちしてくれ
834,9,9,,,"Hereafter, however serious your illness may be, I assure you salvation in every case.",konosaki wa donna mutsukashi yamai demo   mina ukeyote tasuke suru zo ya,このさきハどんなむつかしやまいでも,みなうけよふてたすけするぞや
835,9,10,,,"Though there should be nothing called illness in human beings, no one knows the beginning of this world.",ningen ni yamai to yute nai keredo   kono yo hajimari shirita mono nashi,にんけんにやまいとゆうてないけれど,このよはじまりしりたものなし
836,9,11,,,"Because of My desire to have you know this, I began doctors and medicine for weeding and fertilizing.",kono koto o shirashitai kara dandan to   shuri ya koe ni isha kusuri o,この事をしらしたいからたん／＼と,しゆりやこゑにいしやくすりを
837,9,12,,,"From now on, I shall teach you everything about all matters. Listen closely to whatever I say.",korekara wa nanika yorozu o mina toku de   donna koto demo shikato kiku nari,これからハなにかよろづをみなとくで,どんな事でもしかときくなり
838,9,13,,,"Though even until now I have taught most of My teachings, there remains a truth yet untold.",koremade mo taite hanashi mo toitaredo   mada yute nai shinjitsu no koto,これまでもたいてはしもといたれど,まだゆうてないしんぢつの事
839,9,14,,,What do you think I shall say from today on? The mind of Tsukihi truly hastens.,kyokara wa dono yona koto o yu yara na   Tsukihi no kokoro makoto sekikomi,けふからハどのよな事をゆうやらな,月日の心まことせきこみ
840,9,15,,,What is it that I hasten day after day? It is solely the preparation for Tsukihi to rush out.,nichinichi ni nani sekikomu to yu naraba   Tsukihi tobideru moyo bakari o,にち／＼になにせきこむとゆうならば,月日とびでるもよふばかりを
841,9,16,,,Listen closely to this talk and understand it well. There is no knowing what I shall do.,kono hanashi shikkari kiite shochi seyo   donna koto oba suru ya shiren de,このはなししいかりきいてしよちせよ,どんな事をばするやしれんで
842,9,17,,,Please understand well what I say about the conditions of the path ahead. This is the request of Tsukihi.,konosaki no michi no yodai shikkari to   kikiwakete kure Tsukihi tanomi ya,このさきのみちのよふだいしいかりと,きゝわけてくれ月日たのみや
843,9,18,,1,"When you hear that Tsukihi has rushed out, quickly bring out the Kanrodai.",Tsukihi yori tobideta koto o kiita nara   Kanrodai o hayaku dasu yo,月日よりとびでた事をきいたなら,かんろふだいをばやくだすよふ
844,9,19,,1,"Prepare your minds for the place of the Jiba, the place where the Kanrodai is to be set up.",Kanrodai sueru tokoro o shikkari to   Jiba no tokoro o kokoro zumori o,かんろたいすへるところをしいかりと,ぢばのところを心づもりを
845,9,20,,1,"If only this is surely settled, there will be no danger in anything at all.",kore saika tashika sadamete oita nara   donna koto demo abunaki wa nai,これさいかたしかさだめてをいたなら,とんな事でもあふなきハない
846,9,21,,,Just a word on where Tsukihi will rush out: to the high and the distant places.,Tsukihi yori tobideru tokoro choto hanashi   takai tokoro ya toi tokoro i,月日よりとびでるところ一寸はなし,高いところやとふいところい
847,9,22,,,"When people hear of this story, there will be talk among everyone of Tsukihi's greatness.",sono hanashi kiitaru naraba ichiretsu wa   nanto Tsukihi wa erai mono ya to,そのはなしきいたるならば一れつわ,なんと月日ハゑらいものやと
848,9,23,,,"Step by step, everyone in the world will speak of it. When that day comes, your heart will be brightened.",sekaiju mina dandan to yu de aro   sono hi kitareba mune ga hareru de,せかいぢうみなたん／＼とゆうてあろ,その日きたればむねかはれるで
849,9,24,,,"From thirty-eight years ago until now, the regret in your heart: how pitiful it is.",imamade wa sanju hachi nen izen kara   mune no zannen makoto kinodoku,いまゝでハ三十八ねんいせんから,むねのさんねんまこときのどく
850,9,25,,,"At this time, I shall make all things clearly known to everyone in the world.",konotabi wa dono yona koto mo shikkari to   mina ichiretsu ni shirasu koto nari,このたびハどのよな事もしいかりと,みな一れつにしらす事なり
851,9,26,,,What do you think it is that I shall make known? I shall make the Parent of Origin clearly known.,shirasuru mo nani shirasuru to omou kana   moto naru Oya o tashika shirasuru,しらするもなにしらするとをもうかな,もとなるをやをたしかしらする
852,9,27,,,"Though I begin to speak to make such a thing known, perhaps no one knows what it is about.",kono yona koto o yuikake shirasuru mo   nanno koto yara tare mo shiromai,このよふな事をゆいかけしらするも,なんの事やらたれもしろまい
853,9,28,,,I begin to make the truth known to all humankind from My desire to save this world.,kono yo o ichiretsu naru ni shinjitsu o   tasuketai kara shirashi kakeru de,このよふを一れつなるにしんちつを,たすけたいからしらしかけるで
854,9,29,,,"Now that I shall work salvation unknown until now, it is necessary to make the origin known.",imamade ni nai tasuke oba suru kara wa   moto o shirasan koto ni oite wa,いまゝでにないたすけをばするからハ,もとをしらさん事にをいてわ
855,9,30,,,"To teach you things unknown until now, I shall make the Parent of Origin clearly known.",imamade mo shiranu koto oba oshieru wa   moto naru Oya o tashika shirasuru,いまゝでもしらぬ事をばをしへるハ,もとなるをやふたしかしらする
856,9,31,,,"When you come to know the Parent of Origin clearly, I shall give you My assurance on anything whatever.",moto naru no Oya o tashikani shirita nara   donna koto demo mina hikiukeru,元なるのをやふたしかにしりたなら,とんな事でもみなひきうける
857,9,32,,,Do not wonder who speaks these words. They are from none other than the mind of Tsukihi.,kono hanashi tare ga yu towa omouna yo   Tsukihi no kokoro bakari naru zo ya,このはなしたれがゆうとハをもうなよ,月日の心ばかりなるぞや
858,9,33,,,Look all over the world and through all ages. You will find many kinds of illnesses so-called.,yorozuyo no sekai ichiretsu miwatase yo   yamai to yu mo iroiro ni aru,よろづよのせかい一れつみハたせよ,やまいとゆうもいろ／＼にある
859,9,34,,,"This time, no matter how serious your illness may be, I shall teach you the family recipe for your assured salvation.",konotabi wa donna mutsukashi yamai demo   ukeyote tasuke kaden oshieru,このたびハどんなむつかしやまいでも,うけよてたすけかでんをしゑる
860,9,35,,,"From now on, I shall tell you clearly about the ingredients. Please understand well, whatever I say.",korekara wa tashikani yakumi yute kikasu   nani o yutemo shochi shite kure,これからハたしかにやくみゆてきかす,なにをゆうてもしよちしてくれ
861,9,36,,,Your suffering at this time must be trying. But look forward to the promise in your future.,konotabi no nayamu tokoro wa tsurakaro   ato no tokoro no tanoshimi o miyo,このたびのなやむところハつらかろふ,あとのところのたのしみをみよ
862,9,37,,,"Before it occurred, I had given you as much notice as I was able. Ponder over it.",sakiyori ni seeippai ni kotowari ga   yute aru zo ya shiyan shite miyo,さきよりにせへいゝばいにことハりが,ゆうてあるぞやしやんしてみよ
