id,part,verse,in_doctrine,in_life_of_oyasama,en,ro,jp_1,jp_2
1250,12,177,,,But what path will be seen tomorrow? The core of your mind will become apparent.,asunichi wa doyu michi o miru yara na   shin no kokoro ga arawarete kuru,あすにちハどふゆうみちをみるやらな,しんの心があらわれてくる
1251,12,178,,,"When this mind is fully apparent, no one will ever be able to turn away.",kono kokoro araware detaru koto naraba   tare mo somuki wa sarani dekemai,この心あらわれでたる事ならば,たれもそむきわさらにてけまい
1252,12,179,,,"When this is seen, all of you, whoever you may be, will bow your head and truly ponder.",kore mitara donna mono demo shinjitsu ni   atama katagete mina shiyan suru,これみたらどんなものでもしんちつに,あたまかたけてみなしやんする
1253,12,180,,,Now ponder! If only the settling of this mind is definitely accomplished...,sa shiyan kono kokoro sai shikkari to   sadame tsuitaru koto de aru nara,さあしやんこの心さいしいかりと,さだめついたる事であるなら
1254,12,181,,,This talk is solely from the mind of Tsukihi. Do not think I have a human mind.,kono hanashi Tsukihi no kokoro bakari ya de   ningen gokoro aru to omouna,このはなし月日の心ばかりやで,にんけん心あるとをもうな
1255,12,182,,,"If all of you in the world pray with this thought sincerely held, you shall receive any blessing, whatever it may be.",kono koto o mina ichiretsu wa shinjitsu ni   omote tanomeba donna koto demo,この事をみな一れつハしんちつに,をもてたのめばどんな事でも
1256,13,1,,,"Until today, you have worried about many things. But from tomorrow, a broad path will open.",kyomade wa nanika shinpai shita naredo   asunichi kara wa okwan no michi,一けふまでわなにかしんばいしたなれど,あすにちからわをふくハんのみち
1257,13,2,,,"Until now, because I foresaw all the paths of hardship, My words were filled with warnings.",imamade wa donna nanju na michisuji mo   miete aru kara kotowari bakari,いまゝでハどんななんぢうなみちすちも,みへてあるからことわりばかり
1258,13,3,,,"Hereafter, as it is Tsukihi who firmly assures you, there will be no danger in anything at all.",konosaki wa tashika ukeyau Tsukihi niwa   donna koto demo abunaki wa nai,このさきハたしかうけやう月日にハ,どんな事でもあふなきハない
1259,13,4,,,"Whatever tidings you may hear step by step, rejoice all the world. They are the workings of Tsukihi.",dandan to donna hanashi o kiita tote   sekai tanoshime Tsukihi hataraki,たん／＼とどんなはなしをきいたとて,せかいたのしめ月日はたらき
1260,13,5,,,The work that Tsukihi will go forth to do from now on: perhaps no one knows what it will be.,korekara wa Tsukihi dekakeru hataraki ni   nani o suru tomo tare mo shiromai,これからわ月日でかけるはたらきに,なにをするともたれもしろまい
1261,13,6,,,"Day after day, looking throughout the world, I feel pity for all My children.",nichinichi ni sekai no tokoro misumaseba   ichiretsu kodomo ijirashii koto,にち／＼にせかいのところみすませば,一れつこどもいぢらしい事
1262,13,7,,,All the efforts of Tsukihi made step by step are solely to hasten preparations for your salvation.,Tsukihi niwa dandan donna koto demo na   tasukeru moyo seku bakari ya de,月日にわたん／＼どんな事でもな,たすけるもよふせくはかりやで
1263,13,8,,,"Until now, I have given you nothing but warnings. From now on, there will be warnings no longer.",koremade wa kotowari bakari yute oita   mo korekara wa kotowari wa nai,これまでハことわりはかりゆてをいた,もふこれからハことハりわない
1264,13,9,,,"Until today, being aware of nothing, you have used only the human mind and worried yourselves.",kyomade wa nanimo shirazu ni ningen no   kokoro bakari de shinpai o shita,けふまでわなにもしらすににんけんの,心ばかりでしんはいをした
1265,13,10,,,"From now, firmly replace that mind, lean on God, and do the Joyous Service.",korekara wa kokoro shikkari irekaete   Kami ni motarete Yoki-zutome o,これからハ心しいかりいれかへて,神にもたれてよふきつとめを
1266,13,11,,,"When it is done, I shall directly reveal blessings clearly. Watch for them.",shitaru nara sono mama suguni shikkari to   riyaku arawasu kore o mite kure,したるならそのまゝすくにしいかりと,りやくあらわすこれをみてくれ
1267,13,12,,,"If only the blessings are clearly seen, thereafter all will be the Kanrodai for all time.",kore saika tashika riyaku ga mieta nara   ato wa itsu demo mina Kanrodai,これさいかたしかりやくがみへたなら,あとわいつてもみなかんろふだい
1268,13,13,,,"Hereafter, you shall not be able to turn away from whatever words Tsukihi once says.",konosaki wa Tsukihi ichido yuta koto   donna koto demo somuki dekemai,このさきわ月日一どふゆうた事,どんな事でもそむきでけまい
1269,13,14,,,"If you erase the words of Tsukihi, I shall withdraw at once. Beware!",Tsukihi yori yutaru koto o kesu naraba   suguni shirizoku shochi shite iyo,月日よりゆうたる事をけすならば,すぐにしりぞくしよちしていよ
1270,13,15,,,"Until now, in the minds of those within and those of the world, there has been no true understanding.",imamade wa uchi mo sekai mo shinjitsu no   kokoro ni wakari sarani nai node,いまゝでハうちもせかいもしんちつの,心にわかりさらにないので
1271,13,16,,,"For Tsukihi, this is the greatest regret. If I could somehow make your minds clear...",Tsukihi niwa daiichi kore ga zannen na   nanto kore oba sumashitaru nara,月日にハ大一これがざんねんな,なんとこれをばすましたるなら
1272,13,17,,,How can I bring understanding to your minds? In any case I must admonish you.,kono kokoro doshita naraba wakaru yara   nandemo iken seneba naran de,この心どふしたならばわかるやら,なんてもいけんせねならんで
1273,13,18,,,"This admonition is not just for a few. As it concerns the hearts of so many, it is indeed difficult.",iken demo chotto no hito dewa nai karani   oku no mune ga kore wa mutsukashi,いけんでも一寸の人でわないからに,をふくのむねがこれわむつかし
1274,13,19,,,"However difficult it may be, I shall admonish My children, one and all.",ika hodoni mutsukashi koto to yuta tote   meme no kodomo iken suru zo ya,いかほどにむつかし事とゆうたとて,めへ／＼のこどもいけんするぞや
1275,13,20,,,"What is the best way to accomplish it? By all means, I shall manifest the regret of God.",kono moyo doshita naraba yokaro zo   nandemo Kami no zanen arawasu,このもよふどふしたならばよかろふぞ,なんでも神のさねんあらわす
1276,13,21,,,"Day by day and step by step, the dust piles up and fills the heart of God.",nichinichi ni Kami no mune niwa dandan to   hokori ippai tsumori aredomo,にち／＼に神のむねにハたん／＼と,ほこりいゝばいつもりあれども
1277,13,22,,,This dust is difficult to sweep away. But if you only begin the Service...,kono hokori soji suru no wa mutsukashii   Tsutome nari tomo kakaritaru nara,このほこりそふぢするのハむつかしい,つとめなりともかゝりたるなら
1278,13,23,,,"If only your minds are truly accepted by God, I shall sweep away any dust whatever.",kokoro sai shinjitsu Kami ga uketoreba   donna hokori mo soji suru nari,心さいしんぢつ神がうけとれば,どんなほこりもそふぢするなり
1279,13,24,,,"If only the innermost hearts of all humankind are swept clean,",ichiretsu no mune no uchi sai sukiyaka ni   soji shitateta koto de aru nara,いちれつのむねのうちさいすきやかに,そふちしたてた事であるなら
1280,13,25,,,"Then, the whole world will be spirited and joyousness will come of its own accord.",sorekara wa sekaiju wa ki ga isamu   yokizukume ni hitori naru zo ya,それからわせかいぢううハきがいさむ,よふきづくめにひとりなるぞや
1281,13,26,,,"Listen! From the high mountains to the low valleys, I see no one but Tsukihi's children.",shikato kike takayama nitemo tanisoko mo   mireba Tsukihi no kodomo bakari ya,しかときけ高山にてもたにそこも,みれば月日のこどもばかりや
1282,13,27,,,"You human beings must all love your children. From this, please think of the regret of God.",ningen mo ichiretsu kodomo kawaikaro   Kami no zannen kore omote kure,にんけんも一れつこともかハいかろ,神のさんねんこれをもてくれ
1283,13,28,,,"Hitherto, no matter what had been seen, God only looked on, keeping still.",koremade wa dono yona koto o mita totemo   Kami no ho niwa jitto mite ita,これまてハどのよな事をみたとても,神のほふにハぢいとみていた
1284,13,29,,,"This time, as the day is pressing, I shall speak out on everything, whatever it may be.",konotabi wa mo hi ga tsunde aru kara na   donna koto demo mina yu hodoni,このたびわもふひがつんであるからな,どんな事でもみなゆうほどに
1285,13,30,1,,"Though Tsukihi looks all over the world, there is no one who knows the origin.",Tsukihi niwa sekaiju o miwatasedo   moto hajimari o shirita mono nashi,月日にわせかいぢううをみハたせど,もとはじまりをしりたものなし
1286,13,31,1,,"Desiring to teach this origin to the world by all means, Tsukihi has become revealed.",kono moto o dozo sekai e oshietasa   sokode Tsukihi ga arawarete deta,このもとをどふぞせかいへをしへたさ,そこで月日があらわれてゞた
1287,13,32,,,About the regret of Tsukihi at this time: know that it is not a small matter.,konotabi no Tsukihi zanen to yu mono wa   yoi naru koto de nai to omoe yo,このたびの月日ざねんとゆうものわ,よいなる事でないとをもゑよ
1288,13,33,,,Tsukihi desires to teach this truth throughout the world by all means.,Tsukihi niwa kono shinjitsu o sekaiju e   doshite nari to oshietai kara,月日にハこのしんぢつをせかへぢうゑ,どふしてなりとをしへたいから
1289,13,34,,,"Unaware of it, you erase all the words of Tsukihi, and all that remains is rampant human thinking.",sore shirazu Tsukihi yu koto mina keshite   ato wa ningen gokoro habikaru,それしらず月日ゆう事みなけして,あとわにんけん心はびかる
1290,13,35,,,"Hereafter, I shall clear away all the regret and anger of Tsukihi. Are you aware of it?",konosaki wa Tsukihi no zanen rippuku o   mina harasu de na kore ga shochi ka,このさきハ月日のざねんりいふくを,みなはらすでなこれがしよちか
1291,13,36,,,"After the regret and anger of Tsukihi are cleared away, I shall open a marvelous path.",Tsukihi nimo zanen rippuku harashitara   ato wa mezurashi michi o tsukeru de,月日にもざねんりいふくはらしたら,あとハめづらしみちをつけるで
1292,13,37,,,What do you think this path is to be? It is solely mutual help among all people in all matters.,kono michi wa doyu koto ni omou kana   yorozu tagaini tasuke bakari o,このみちハどふゆう事にをもうかな,よろづたがいにたすけばかりを
1293,13,38,,,"If all the world comes to help one another, Tsukihi will accept all your minds.",sekaiju tagaini tasuke suru naraba   Tsukihi mo kokoro mina hikiukeru,せかいぢうたがいにたすけするならば,月日も心みなひきうける
1294,13,39,,,"If Tsukihi accepts your minds, I shall work in all matters whatever.",Tsukihi nimo kokoro hikiuke suru kara wa   donna koto demo hataraki o suru,月日にも心ひきうけするからわ,どんな事でもはたらきをする
1295,13,40,,,What do you think this working is to be? It is solely to distinguish between good and evil.,hataraki mo doyu koto ni omou kana   zen to aku to o wakeru bakari ya,はたらきもどふゆう事にをもうかな,善とあくとをわけるばかりや
1296,13,41,,,"Until today, whatever wrongdoing there is said to be, perhaps none of you has known of it on your body.",kyomade wa donna akuji to yuta tote   waga mi ni shirita mono wa arumai,けふまでわどんなあくじとゆうたとて,わがみにしりたものハあるまい
1297,13,42,,,"God will teach you the truth about this. Ponder over it, all of you.",kono kokoro Kami ga shinjitsu yute kikasu   mina ichiretsu wa shiyan shite kure,この心神がしんぢつゆてきかす,みないちれつわしやんしてくれ
1298,13,43,1,1,All of you throughout the world are brothers and sisters. There should be no one called an outsider.,sekaiju ichiretsu wa mina kyodai ya   tanin to yu wa sarani nai zo ya,せかいぢういちれつわみなきよたいや,たにんとゆうわさらにないぞや
1299,13,44,,,That there is no one who knows the origin of this is the very cause of the regret of Tsukihi.,kono moto o shiritaru mono wa nai node na   sore ga Tsukihi no zanen bakari ya,このもとをしりたるものハないのでな,それが月日のざねんばかりや
1300,13,45,,1,Those living in the high mountains and those living in the low valleys: their souls are all the same.,takayama ni kurashite irumo tanisoko ni   kurashite irumo onashi tamahii,高山にくらしているもたにそこに,くらしているもをなしたまひい
1301,13,46,,1,"Furthermore, the instruments you use daily are all things lent by Tsukihi.",soreyori mo dandan tsukau dogu wa na   mina Tsukihi yori kashimono naru zo,それよりもたん／＼つかうどふぐわな,みな月日よりかしものなるぞ
1302,13,47,,1,"Unaware of this, the thought in the minds of all human beings is that there are the high and the low.",sore shirazu mina ningen no kokoro dewa   nando takabiku aru to omote,それしらすみなにんけんの心でわ,なんどたかびくあるとをもふて
1303,13,48,,1,"By all means, Tsukihi desires to make the truth of this matter clearly understood by the whole world.",Tsukihi niwa kono shinjitsu o sekaiju e   dozo shikkari shochi sashitai,月日にハこのしんぢつをせかいぢうへ,どふぞしいかりしよちさしたい
1304,13,49,,1,"If only this is clearly understood, the root of rebellion will be cut off.",kore saika tashikani shochi shita naraba   muhon no ne wa kirete shimau ni,これさいかたしかにしよちしたならば,むほんのねへわきれてしまうに
1305,13,50,,1,Tsukihi sincerely desires only to end the wars among those on the high mountains.,Tsukihi yori shinjitsu omou takayama no   tatakai saika osametaru nara,月日よりしんぢつをもう高山の,たゝかいさいかをさめたるなら
1306,13,51,,1,By what means can they be ended? If only you set forth on the Joyous Service...,kono moyo doshita naraba osamaro   Yoki-zutome ni detaru koto nara,このもよふどふしたならばをさまろふ,よふきづとめにでたる事なら
1307,13,52,,1,Do not wonder from whose mind these words come. They are solely from the mind of Tsukihi.,kono kokoro tare ga yu towa omouna yo   Tsukihi no kokoro bakari naru zo ya,この心たれがゆうとハをもうなよ,月日の心ばかりなるぞや
1308,13,53,,1,"It is difficult to do this Service because of the high mountains, but God gives you firm assurance.",kono Tsutome takayama nitewa mutsukashii   Kami ga shikkari hikiuke o suru,このつとめ高山にてハむつかしい,神がしいかりひきうけをする
1309,13,54,,1,"This time, in all matters, I shall truly give you My firm assurance and shall work.",konotabi wa donna koto demo shinjitsu ni   tashika ukeyai hataraki o suru,このたびわどんな事でもしんちつに,たしかうけやいはたらきをする
1310,13,55,,,"When God goes forth and works throughout the world, there will be nothing to fear in doing any Service.",Kami ga dete sekaiju o hatarakeba   donna Tsutome mo kowami nai zo ya,神がでゝせかいぢううをはたらけば,どんなつとめもこハみないぞや
1311,13,56,,,"Listen! Though the high mountains, boastful, have done as they pleased to the low valleys,",shikato kike takayama ya tote tanisoko o   mamani shirareta koto de aredomo,しかときけ高山やとてたにそこを,まゝにしられた事であれども
1312,13,57,,,"From now on, Tsukihi shall come out in their place. Let them try to do as they please if they dare.",korekara wa Tsukihi kawari ni deru hodoni   mamani shiyo nara sureba shite miyo,これからわ月日かハりにでるほどに,まゝにしよならすればしてみよ
1313,13,58,,,"Everything will be different from what it has been until now. From now on, it will be as God intends.",imamade to nanika monku ga chigau de na   korekara saki wa Kami no mama ya de,いまゝでとなにかもんくがちがうてな,これからさきハ神のまゝやで
1314,13,59,,,Perhaps no one knows the intention of Tsukihi in descending from Heaven.,Tsukihi yori amakudari taru kokoro na   nanno koto yara tare mo shiromai,月日よりあまくだりたる心な,なんの事やらたれもしろまい
1315,13,60,,,"First, to help those who grow crops, I desired to teach you on the matter of the fertilizer.",daiichi wa ryuke tsukuru o tasuketasa   koe ichijo o oshietai kara,大一わりゆうけつくるをたすけたさ,こゑ一ぢよふをしへたいから
1316,13,61,,,Do not wonder why the fertilizer is effective. If only God accepts your mind...,koe demo na doshite kiku to omouna yo   kokoro o Kami ga uketorita nara,こゑてもなどふしてきくとをもうなよ,こゝろを神がうけとりたなら
1317,13,62,,,"Though God has been speaking the truth until now, even those within only have doubts.",imamade wa shinjitsu Kami ga yute aredo   uchi kara shitemo utagau bakari,いまゝてハしんぢつ神がゆてあれど,うちからしてもうたがうはかり
1318,13,63,,,"This time, do not doubt whatever I say. If you doubt, Tsukihi will withdraw.",konotabi wa nani o yutemo utagau na   kore utagaeba Tsukihi shirizoku,此のたびハなにをゆうてもうたがうな,これうたがへば月日しりぞく
1319,13,64,,,"I repeat this to you tediously. If you doubt, you will truly repent it.",kono koto wa akudoi hodomo yute oku   kore utagaeba makoto kokwai,この事ハあくどいほともゆうてをく,これうたがへばまことこふくハい
1320,13,65,,,What Tsukihi has once said will never become false through all time.,Tsukihi yori ichido yute oita koto   itsu ni naritemo chigau koto nashi,月日より一どふゆうてをいた事,いつになりてもちがう事なし
1321,13,66,,,"Until now, all of you have only doubted whatever Tsukihi said, always erasing it by your words.",imamade wa Tsukihi nani goto yuta tote   mina utagote yuikesu bakari,いまゝでわ月日なに事ゆうたとて,みなうたごふてゆいけすばかり
1322,13,67,,,"For Tsukihi, this is the greatest regret. I shall correct this matter by all means.",Tsukihi niwa daiichi kore ga zannen na   nandemo kore o shikato kimeru de,月日にハ大一これがざんねんな,なんでもこれをしかときめるで
1323,13,68,,,"From now on, you must not turn away from whatever Tsukihi says. You must lean on God.",korekara wa Tsukihi yu koto nani goto mo   somukan yoni Kami ni motare yo,これからハ月日ゆう事なに事も,そむかんよふに神にもたれよ
1324,13,69,,,"Then I, God, shall truly give you My firm assurance and shall work.",shitaru nara Kami no ho nimo shinjitsu ni   tashika hikiuke hataraki o suru,したるなら神のほふにもしんちつに,たしかひきうけはたらきをする
1325,13,70,,,"As Tsukihi persuades you to such a degree, if your mind is in error, I shall withdraw at once.",Tsukihi niwa kora hodo kudoki tsumeru kara   kokoro chigaeba suguni shirizoku,月日にハこらほどくどきつめるから,心ちがゑばすぐにしりぞく
1326,13,71,1,,"If your mind is truly sincere, there will never be a failure in any salvation.",shinjitsu ni kokoro ni makoto aru naraba   donna tasuke mo chigau koto nashi,しんちつに心にまことあるならば,どんなたすけもちがう事なし
1327,13,72,,,"Hereafter, in order that there be no failure in the fertilizer for the crops, please understand Me clearly.",konosaki wa ryuke no koe o chigawan yo   dozo shikkari shochi shite kure,このさきハりゆけのこへをちがハんよ,どふぞしいかりしよちしてくれ
1328,13,73,,,"From today, I shall begin to tell you the thoughts of Tsukihi on all matters whatever.",kyokara wa Tsukihi no omou koto oba na   dono yona koto mo mina yuikakeru,けふからわ月日のをもう事をばな,どのよな事もみなゆいかける
1329,13,74,,,"Though even until now I have told you almost everything, I have not yet told you Tsukihi's intention.",imamade mo taite hanashi mo toitaredo   Tsukihi omowaku mada yute nai,いまゝでもたいてはなしもといたれど,月日をもハくまだゆうてない
1330,13,75,,,"From now on, whatever talks I may give, never think that they are false.",korekara wa donna hanashi o shitaru tomo   kore o kanarazu uso to omouna,これからハどんなはなしをしたるとも,これをかならすうそをもうな
1331,13,76,,,"There is no knowing what I shall say, for the mind of Tsukihi hastens.",dono yona koto o yu yara shiren de na   Tsukihi no kokoro sete iru kara,どのよふな事をゆうやらしれんてな,月日の心せゑているから
1332,13,77,,,"What do you think My thoughts are about? They are about Nihon, Kara, and Tenjiku.",kono kokoro doyu koto ni omou kana   nihon mo kara mo tenjiku made mo,この心どふゆう事にをもうかな,にほんもからもてんちくまでも
1333,13,78,,,"Though there are many leagues in between, I shall work even in a single night.",kono aida michinori yohodo aru keredo   ichiya no ma nimo hataraki o suru,このあいだみちのりよほどあるけれど,いちやのまにもはたらきをする
1334,13,79,,,What are you humans thinking of this talk? Your bodies are things lent by Tsukihi and you are all children of Mine.,kono hanashi ningen nanto omote iru   Tsukihi kashimono mina waga kodomo,このはなしにんけんなんとをもている,月日かしものみなわがこども
1335,13,80,,,"So long as Tsukihi keeps still, there will be no hope of a settling.",itsumade mo Tsukihi jikkuri shite ireba   itsu ni naritemo osamaru me nashi,いつまでも月日ぢいくりしていれば,いつになりてもをさまるめなし
1336,13,81,,,"Therefore, Tsukihi will go forth to work. There is no one who knows where I shall go.",soreyue ni Tsukihi dekakeru hataraki ni   doko e deru yara shirita mono nashi,それゆへに月日でかけるはたらきに,とこへでるやらしりたものなし
1337,13,82,,,I say that I shall purify all minds throughout the world. Never think of it as a small matter.,sekaiju kokoro sumasu to yu kara wa   chotto no koto ya to sarani omouna,せかいぢう心すますとゆうからわ,一寸の事やとさらにをもうな
1338,13,83,,,"In whatever matters, if the innermost heart of each of you is purified, there will be no danger.",dono yona koto demo meme mune no uchi   sumashita naraba abunaki wa nai,どのよふな事てもめへ／＼むねのうち,すましたならばあふなきわない
1339,13,84,,,"Day after day, the thought of Tsukihi is only to wait for a large number of people to come to Me step by step.",dandan to Tsukihi nichinichi omowaku wa   oku no hito o matsu bakari ya de,たん／＼と月日にち／＼をもハくわ,をふくの人をまつばかりやで
1340,13,85,1,,The reason I am waiting for these people is that I desire to save all of My children in the world.,kono hito o doyu koto de matsu naraba   ichiretsu waga ko tasuketai kara,この人をどふゆう事でまつならば,一れつわがこたすけたいから
1341,13,86,,,You cannot know what a marvelous path will come into sight this year.,kotoshi niwa donna mezurashi michisuji ga   miete kuru yara kore shiren de na,ことしにハどんなめづらしみちすじが,みゑてくるやらこれしれんてな
1342,13,87,,,"No matter how I try to tell you the truth by words, there is no one who understands.",kuchi saki de nanbo shinjitsu yuta tote   tare ka kikiwake suru mono wa nai,口さきでなんほしんちつゆうたとて,たれかきゝわけするものハない
1343,13,88,,,"Therefore, Tsukihi will at this time demonstrate the truth for you in all matters.",soreyue ni Tsukihi konotabi dono yona   koto mo shinjitsu mina shite miseru,それゆへに月日このたびどのよふな,事もしんちつみなしてみせる
1344,13,89,,,"Whatever I do, never think that there is any human mind mixed in it.",dono yona koto o shitaru mo ningen no   kokoro majiru to sarani omouna,どのよふな事をしたるもにんけんの,心まぢるとさらにをもうな
1345,13,90,,,Tsukihi cannot bear to look on any longer. That is why I shall work in all matters.,Tsukihi niwa amari shinjitsu mikaneru de   sokode dono yona koto mo suru no ya,月日にハあまりしんぢつみかねるで,そこでとのよな事もするのや
1346,13,91,,,"However strong or youthful you may be, never think that such a condition is reliable.",ika hodono goteki tarumo wakaki demo   kore o tayori to sarani omouna,いかほどのごうてきたるもハかきても,これをたよりとさらにをもうな
