id,part,verse,in_doctrine,in_life_of_oyasama,en,ro,jp_1,jp_2
1,1,1,1,1,"Looking all over the world and through all ages, I find no one who has understood My heart.",yorozuyo no sekai ichiretsu miharasedo   mune no wakarita mono wa nai kara,よろつよのせかい一れつみはらせど,むねのハかりたものハないから
2,1,2,1,1,"So should it be, for I have never taught it to you. It is natural that you know nothing.",sono hazu ya toite kikashita koto wa nai   nanimo shiran ga muri de nai zo ya,そのはづやといてきかした事ハない,なにもしらんがむりでないそや
3,1,3,1,1,"At this time, I, God, reveal Myself and teach the truth of all things in detail.",konotabi wa Kami ga omote i arawarete   nanika isai o toite kikasuru,このたびハ神がをもていあらハれて,なにかいさいをといてきかする
4,1,4,1,1,"You are calling this place the Jiba, the Residence of God, in Yamato, but you may not know the origin.",kono tokoro Yamato no Jiba no kamigata to   yute iredomo moto wa shiromai,このところやまとのしバのかみがたと,ゆうていれども元ハしろまい
5,1,5,,1,"When you learn of this origin in full, a great yearning will come over you, whoever you may be.",kono moto o kuwashiku kiita koto naraba   ikana mono demo mina koishi naru,このもとをくハしくきいた事ならバ,いかなものでもみなこいしなる
6,1,6,,1,"If you wish to know and will come to Me, I shall teach you the original cause of all things.",kiki takuba tazune kuru nara yute kikaso   yorozu isai no moto no innen,きゝたくバたつねくるならゆてきかそ,よろづいさいのもとのいんねん
7,1,7,,1,"As God is revealed and teaches the truth of all things in detail, the minds of all in the world will become spirited.",Kami ga dete nanika isai o toku naraba   sekai ichiretsu kokoro isamuru,かみがでてなにかいさいをとくならバ,せかい一れつ心いさむる
8,1,8,,1,"As I am in haste to save all of you quickly, I set out to make all minds in the world spirited.",ichiretsu ni hayaku tasuke o isogu kara   sekai no kokoro isame kakarite,いちれつにはやくたすけをいそぐから,せかいの心いさめかゝりて
9,1,9,,1,"As your minds become spirited step by step, there shall be rich harvests and prosperity everywhere.",dandan to kokoro isande kuru naraba   sekai yononaka tokoro hanjo,だん／＼と心いさんてくるならバ,せかいよのなかところはんじよ
10,1,10,,1,"Hereafter, I shall teach you the hand movements of the Kagura Service and wait for all to assemble and perform it.",konosaki wa Kagura-zutome no te o tsukete   minna sorote Tsutome matsu nari,このさきハかくらづとめのてをつけて,みんなそろふてつとめまつなり
11,1,11,1,1,"When all are assembled and quickly do the Service, as those close to Me become spirited, God, also, will be spirited.",mina sorote hayaku Tsutome o suru naraba   soba ga isameba Kami mo isamuru,みなそろてはやくつとめをするならバ,そばがいさめバ神もいさむる
12,1,12,,1,"When the mind of God is depressed over everything, the growth of all crops will be depressed, too.",ichiretsu ni Kami no kokoro ga izumu nara   mono no ryuke ga mina izumu nari,いちれつに神の心がいづむなら,ものゝりうけかみないつむなり
13,1,13,,1,The mind that causes depressed crops is pitiful. Quickly become spirited so that the crops are not depressed.,ryukei no izumu kokoro wa kinodoku ya   izuman yo to hayaku isame yo,りうけいのいつむ心ハきのとくや,いづまんよふとはやくいさめよ
14,1,14,,1,"If you wish that the crops grow spiritedly, do the Kagura Service and the Teodori.",ryukei ga isami deru yo to omou nara   Kagura-zutome ya Teodori o seyo,りうけいがいさみでるよとをもうなら,かぐらつとめやてをとりをせよ
15,1,15,,,"At this time, begin the Teodori quickly. That will be the sign for miraculous things to come.",konotabi wa hayaku Teodori hajime kake   kore ga aizu no fushigi naru zo ya,このたびハはやくてをどりはじめかけ,これがあいずのふしきなるそや
16,1,16,,,"Speaking of the sign and miracles, they are not yet seen. When the day arrives, you will understand clearly.",kono aizu fushigi to yute miete nai   sono hi kitareba tashika wakaru zo,このあいずふしぎとゆうてみへてない,そのひきたれバたしかハかるぞ
17,1,17,,,"When the day arrives and understanding comes, whoever you may be, you will all be filled with admiration.",sono hi kite nanika wakari ga tsuita nara   ikana mono demo mina ga kanshin,そのひきてなにかハかりがついたなら,いかなものてもみながかんしん
18,1,18,,,To teach of things after they appear is the way of the world. I teach of things before they appear.,miete kara toite kakaru wa sekainami   mien saki kara toite oku zo ya,みへてからといてかゝるハせかいなみ,みへんさきからといてをくそや
19,1,19,,,"Hereafter, I desire that those in high places gradually calm their minds and make peace.",konosaki wa kami taru kokoro dandan to   kokoro shizumete waboku naru yo,このさきハ上たる心たん／＼と,心しづめてハぶくなるよふ
20,1,20,,,"This peace may seem difficult to attain, but it will come step by step through God's protection.",kono waboku mutsukashi yoni aru keredo   dandan Kami ga shugo suru nari,このハほくむつかしよふにあるけれと,だん／＼神がしゆこするなり
21,1,21,1,1,This is a world constructed on reason. So I shall press upon you everything with the reason in verse.,kono yo wa rii de semetaru sekai nari   nanika yorozu o uta no ri de seme,このよふハりいでせめたるせかいなり,なにかよろづを歌のりでせめ
22,1,22,,1,"I shall press, though not by force or word of mouth. I shall press by the tip of My writing brush.",semeru tote tezashi suru dewa nai hadoni   kuchi demo yuwan fudesaki no seme,せめるとててざしするでハないほどに,くちでもゆハんふでさきのせめ
23,1,23,,1,"It is all very well if you err in nothing. But should you err, I shall inform you by verse.",nanimo kamo chigawan koto wa yokeredomo   chigai aru nara uta de shirasuru,なにもかもちがハん事ハよけれども,ちがいあるなら歌でしらする
24,1,24,,,I pity you when My warnings become manifest. Know that any illness is from the mind.,shirashitara araware deru wa kinodoku ya   ikana yamai mo kokoro kara tote,しらしたらあらハれでるハきのどくや,いかなやまいも心からとて
25,1,25,,,What you are calling an illness is not an ordinary one. It is the anger of God now being shown.,yamai tote sekainami dewa nai hodoni   Kami no rippuku imazo arawasu,やまいとてせかいなみでハないほどに,神のりいふくいまぞあらハす
26,1,26,,,"Because you have not obeyed the words of God even until now, I could not avoid showing it.",imamade mo Kami no yu koto kikan kara   zehi naku omote arawashita nari,いまゝでも神のゆう事きかんから,ぜひなくをもてあらハしたなり
27,1,27,,,"So much of God's regret is now being shown, the matter is beyond the help of doctors and medicines.",kora hodono Kami no zannen deteru kara   isha mo kusuri mo kore wa kanawan,こらほどの神のざんねんでてるから,いしやもくすりもこれハかなハん
28,1,28,,,"Never think of this one matter as being ordinary. By all means, I shall admonish you with My verses.",kore bakari hitonami ya towa omouna yo   nandemo kore wa uta de semekiru,これハかりひとなみやとハをもうなよ,なんてもこれハ歌でせめきる
29,1,29,,1,"This time, I shall clean the Residence thoroughly. Watch, as I show you how.",konotabi wa yashiki no soji sukiyaka ni   shitatete miseru kore o mite kure,このたびハやしきのそふじすきやかに,したゝてみせるこれをみてくれ
30,1,30,,,"When this cleaning is thoroughly done, the truth shall be known and it will be told and retold.",soji sai sukiyaka shitaru koto naraba   shirite hanashite hanashi suru nari,そふじさいすきやかしたる事ならバ,しりてはなしてはなしするなり
31,1,31,,,What is the cause of My regret thus far? The lameness of your leg is My prime regret.,koremade no zannen naru wa nanino koto   ashi no chinba ga ichi no zannen,これまでのざんねんなるハなにの事,あしのちんばが一のさんねん
32,1,32,,,You are saying that your leg is affected by illness. It is not an illness but the anger of God.,kono ashi wa yamai to yute iru keredo   yamai dewa nai Kami no rippuku,このあしハやまいとゆうているけれど,やまいでハない神のりいふく
33,1,33,,,My anger is not a small matter. It is the result of causes accumulated and piled up.,rippuku mo chotto no koto dewa nai hodoni   tsumori kasanari yue no koto nari,りいふくも一寸の事でハないほどに,つもりかさなりゆへの事なり
34,1,34,,,To say why it is that I am angry: it is because the wrongdoing has not been removed.,rippuku mo naniyue naru to yu naraba   akuji ga nokan yue no koto nari,りいふくもなにゆへなるどゆうならハ,あくじがのかんゆへの事なり
35,1,35,,,"Unless this wrongdoing is completely removed, know that it will stand in the way of the construction.",kono akuji sukiyaka noken koto nitewa   fushin no jama ni naru to koso shire,このあくじすきやかのけん事にてハ,ふしんのしやまになるとこそしれ
36,1,36,,,"No matter how stubborn this wrongdoing may be, it will be removed by the admonishment of God.",kono akuji nanbo shibutoi mono ya tote   Kami ga semekiri nokete miseru de,このあくじなんぼしぶといものやどて,神がせめきりのけてみせるで
37,1,37,,,"If this wrongdoing is completely cleared away, the lameness of your leg, also, will be cleared away.",kono akuji sukiyaka noketa koto naraba   ashi no chinba mo sukiyaka to naru,このあくじすきやかのけた事ならバ,あしのちんばもすきやかとなる
38,1,38,,,"If only your leg is made completely well, nothing will remain but to prepare for the construction.",ashi saika sukiyaka naori shita naraba   ato wa fushin no moyo bakari o,あしさいかすきやかなをりしたならバ,あとハふしんのもよふハかりを
39,1,39,,,Just a word: returning her by the thirtieth of the first month is also from the mind of God.,choto hanashi shogatsu misoka to hi o kirite   okuru mo Kami no kokoro kara tote,一寸はなし正月三十日とひをきりて,をくるも神の心からとて
40,1,40,,,You close to Me may question what I do. This is because you do not know the future.,soba na mono nani goto suru to omoedomo   saki naru koto o shiran yue nari,そバなものなに事するとをもへども,さきなる事をしらんゆへなり
41,1,41,,,"When the day arrives and things are seen, you close to Me will know that God's words never err.",sono hi kite mietaru naraba soba na mono   Kami no yu koto nanimo chigawan,そのひきてみへたるならバそばなもの,神のゆう事なにもちがハん
42,1,42,,,"Until now, you have doubted the words of God. You have been saying that they are all false.",imamade wa Kami no yu koto utagote   nanimo uso ya to yute ita nari,いまゝでハ神のゆう事うたこふて,なにもうそやとゆうていたなり
43,1,43,,,"Among the words of God, who began this world, there is not even a single mistake in a thousand.",kono yo o hajimeta Kami no yu koto ni   sen ni hitotsu mo chigau koto nashi,このよふをはじめた神のゆう事に,せんに一つもちがう事なし
44,1,44,,,"If you begin to see this step by step, be convinced. Every kind of mind will all be revealed.",dandan to miete kita nara tokushin se   ikana kokoro mo mina arawareru,だん／＼とみへてきたならとくしんせ,いかな心もみなあらハれる
45,1,45,,,"Looking all over the world and through all ages, I see various paths of life.",yorozuyo no sekaiju o miwataseba   michi no shidai mo iroiro ni aru,よろづよのせかいぢふうをみハたせバ,みちのしだいもいろ／＼にある
46,1,46,1,,"Hereafter, I shall speak in the metaphor of a path, not indicating any place in particular.",konosaki wa michi ni tatoete hanashi suru   doko no koto tomo sarani yuwan de,このさきハみちにたとへてはなしする,どこの事ともさらにゆハんで
47,1,47,1,1,"Over steep mountains, through tangles of thorns, along narrow ledges, and through brandished swords, if you come,",yamasaka ya ibara guro mo gakemichi mo   tsurugi no naka mo torinuke tara,やまさかやいばらぐろふもがけみちも,つるぎのなかもとふりぬけたら
48,1,48,1,1,"Yet ahead through a sea of flames and a deep abyss, you will arrive at a narrow lane.",mada mieru hi no naka mo ari fuchinaka mo   sore o koshitara hosoi michi ari,まだみへるひのなかもありふちなかも,それをこしたらほそいみちあり
49,1,49,,1,"After following the narrow lane step by step, you will come to a broad way. This is the trustworthy main path.",hosomichi o dandan koseba omichi ya   kore ga tashikana honmichi de aru,ほそみちをだん／＼こせばをふみちや,これがたしかなほんみちである
50,1,50,,1,This talk is not someone else's concern. It is a matter of your own and your single-heartedness with God.,kono hanashi hoka no koto dewa nai hodoni   Kami ichijo de kore waga koto,このはなしほかの事でわないほとに,神一ぢよでこれわが事
51,1,51,,,"Until now, I have spoken solely about matters within. Now, I shall change the topic.",imamade wa uchi naru koto o bakari nari   mo korekara wa monku kawaru zo,いまゝでハうちなる事をばかりなり,もふこれからハもんくかハるぞ
52,1,52,1,,"Looking all over the world and through all ages, I find no one who is evil.",yorozuyo ni sekai no tokoro miwatasedo   ashiki no mono wa sara ni nai zo ya,よろづよにせかいのところみハたせど,あしきのものハさらにないぞや
53,1,53,1,,"Among all humankind, there is no one who is evil. It is only a bit of dust stuck on.",ichiretsu ni ashiki to yute nai keredo   choto no hokori ga tsuita yue nari,一れつにあしきとゆうてないけれど,一寸のほこりがついたゆへなり
54,1,54,,,"Hereafter, calm your minds and ponder. Make sure you will not be remorseful later.",konosaki wa kokoro shizumete shiyan seyo   ato de kokwai naki yoni seyo,このさきハ心しづめてしやんせよ,あとでこふくハいなきよふにせよ
55,1,55,,,Long have you wandered on your path until now. You must be very tired of it.,imamade wa nagai dochu michisugara   yohodo taikutsu shita de aro na,いまゝてハながいどふちふみちすがら,よほどたいくつしたであろをな
56,1,56,,,"Finally this time, a trustworthy place of worship has begun to appear. Be convinced of it!",konotabi wa mo tashika naru mairisho   miete kita zoe tokushin o seyo,このたびハもふたしかなるまいりしよ,みへてきたぞへとくしんをせよ
57,1,57,,,"From now on, I shall teach you about the long journey of humankind. Ponder over it firmly!",korekara wa nagai dochu michisugara   toite kikasuru tokuto shiyan o,これからハながいどふちふみちすがら,といてきかするとくとしやんを
58,1,58,,,"Hereafter, I shall arrange for the settling of matters within. The mind of God is hastening it.",konosaki wa uchi o osameru moyodate   Kami no ho niwa kokoro sekikomu,このさきハうちをおさめるもよふだて,神のほふにハ心せきこむ
59,1,59,,,"Please listen to what God tells you step by step, for I shall never tell you anything wrong.",dandan to Kami no yu koto kiite kure   ashiki no koto wa sarani yuwan de,だん／＼と神のゆふ事きいてくれ,あしきのことハさらにゆハんで
60,1,60,,,You say that you wish to train the child for two or three more years. But she is no longer in the hands of God.,kono kodomo ni nen san nen shikomo to   yute iredomo Kami no tebanare,このこ共二ねん三ねんしこもふと,ゆうていれども神のてはなれ
61,1,61,,,"Ponder well: however dear she may be to you, her parent, you can do nothing if she is out of the hands of God.",shiyan seyo oya ga ika hodo omotemo   Kami no tebanare kore wa kanawan,しやんせよをやがいかほどをもふても,神のてばなれこれハかなハん
62,1,62,,,This world is mixed with wrongdoing. You must not attach yourself to bad causation.,kono yo wa akuji majiri de aru karani   innen tsukeru koto wa ikan de,このよふハあくしまじりであるからに,いんねんつける事ハいかんで
63,1,63,,,You are thinking that you are already near fifty. Yet in the eyes of God you have many years ahead of you.,waga mi niwa mo goju ya to omoedomo   Kami no me niwa mada saki ga aru,,神のめへにハまださきがある
64,1,64,,,"Sixty more years from this year, God promises you with certainty.",kotoshi yori rokuju nen wa shikkari to   Kami no ho niwa shikato ukeyau,ことしより六十ねんハしいかりと,神のほふにハしかとうけやう
65,1,65,,,"From now, replace your mind firmly. Sweep away the wrongdoing and take a young wife.",korekara wa kokoro shikkari irekae yo   akuji harote wakaki nyobo,これからハ心しいかりいれかへよ,あくじはろふてハかきによほふ
66,1,66,,,"This may seem difficult to do, but God will go forth and receive her without fail.",kore totemo mutsukashi yoni aru keredo   Kami ga deta nara morote kuru zo ya,これとてもむつかしよふにあるけれど,神がでたならもろてくるそや
67,1,67,,,"After you have devoted yourself day by day, I shall leave you entrusted with the management of everything.",nichinichi ni kokoro tsukushita sono ue wa   ato no shihai o yorozu makaseru,にち／＼に心つくしたそのゑハ,あとのしはいをよろづまかせる
68,1,68,,,"Of the five, keep two at home. God will take charge of the other three.",go nin aru naka no ni nin wa uchi ni oke   ato san nin wa Kami no hikiuke,五人あるなかのにゝんハうちにをけ,あと三人ハ神のひきうけ
69,1,69,,,Look at things in the world and through all ages. Calm your mind and ponder over them.,yorozuyo no sekai no koto o miharashite   kokoro shizumete shiyan shite miyo,よろづよのせかいの事をみはらして,心しづめてしやんしてみよ
70,1,70,,1,"This has always been the world of God, but it is the first time that I act as a go-between.",imamade mo Kami no sekai de aru keredo   nakadachi suru wa ima ga hajime ya,いまゝても神のせかいであるけれど,なかだちするハ今がはじめや
71,1,71,,,"People will think this is odd. But however much they may laugh, it is of prime importance.",korekara wa sekai no hito wa okashigaru   nanbo warotemo kore ga daiichi,これからハせかいの人ハをかしがる,なんぼハろてもこれが大一
72,1,72,,,Perhaps people will say: What are you doing? But the laughter of people will be God's delight.,sekai niwa nani goto suru to yu de aro   hito no warai o Kami ga tanoshimu,せかいにハなに事するとゆうとであろ,人のハらいを神がたのしむ
73,1,73,,,The self-centered mind will not do. The mind of God differs entirely.,meme no omou kokoro wa ikan de na   Kami no kokoro wa mina chigau de na,めへめへのをもふ心ハいかんでな,神の心ハみなちがうでな
74,1,74,,1,I bring you together according to the causality of your previous lives and protect you. This settles the matter for all time.,zensho no innen yosete shugo suru   kore wa matsudai shikato osamaru,せんしよのいんねんよせてしうごふする,これハまつだいしかとをさまる
75,2,1,,,"From now, I shall begin to open a broad path. I shall make all minds in the world spirited.",korekara wa okwan michi o tsuke kakeru   sekai no kokoro mina isameru de,これからハをくハんみちをつけかける,せかいの心みないさめるで
76,2,2,,,"Those in high places will come at any moment, spirited in mind. The appointed time has arrived.",kami taru wa kokoro isande kuru hodoni   nandoki ni kuru kokugen ga kita,上たるハ心いさんでくるほとに,なんどきにくるこくけんがきた
77,2,3,,1,"After the tea is picked and the plants are trimmed, the Joyous Service will follow.",cha tsunde ato karitorite shimota nara   ato i deru no wa Yoki-zutome ya,ちやつんであとかりとりてしもたなら,あといでるのハよふきづとめや
78,2,4,,1,From where do you think this Service comes? The people in high places will become spirited.,kono Tsutome doko kara kuru to omou kana   kami taru tokoro isami kuru zo ya,このつとめとこからくるとをもうかな,上たるところいさみくるぞや
79,2,5,,,"Step by step, the providence of God will bring about every new and marvelous working.",dandan to Kami no shugo to yu mono wa   mezurashi koto o mina shikakeru de,たん／＼と神のしゆごふとゆうものハ,めつらし事をみなしかけるで
80,2,6,,,"Day after day, the mind of God hastens. What are all of you thinking of it?",nichinichi ni Kami no kokoro no sekikomi o   mina ichiretsu wa nanto omoteru,にち／＼に神の心のせきこみを,みないちれつハなんとをもてる
81,2,7,1,1,Illness and pain of whatever kind do not exist. They are none other than the hastening and guidance of God.,nani nitemo yamai itami wa sarani nashi   Kami no sekikomi tebiki naru zo ya,なにゝてもやまいいたみハさらになし,神のせきこみてびきなるそや
82,2,8,,1,"The reason for My hastening, if you should ask, is that I desire performers for the Service.",sekikomi mo naniyue naru to yu naraba   Tsutome no ninju hoshii koto kara,せきこみもなにゆへなるとゆうならば,つとめのにんぢうほしい事から
83,2,9,,,What do you think this Service is? It is none other than the means to universal salvation.,kono Tsutome nanno koto ya to omote iru   yorozu tasuke no moyo bakari o,このつとめなんの事やとをもている,よろづたすけのもよふばかりを
84,2,10,,,Do not think this salvation is for the present time alone. It will be the Divine Record for eternity.,kono tasuke ima bakari towa omouna yo   kore matsudai no Koki naru zo ya,このたすけいまばかりとハをもうなよ,これまつたいのこふきなるぞや
85,2,11,,,Just a word: you are saying that it is a fit or madness. It is not an illness but the urging of God.,choto hanashi nobose kanteki yute iru   yamai dewa nai Kami no sekikomi,一寸はなしのぼせかんてきゆうている,やまいでハない神のせきこみ　
86,2,12,,,"Step by step, I have taught the truth of single-heartedness with God, but you still do not understand.",dandan to shinjitsu Kami no ichijo o   toite kikasedo mada wakari nai,たん／＼としんぢつ神の一ちよふ,といてきかせどまだハかりない
87,2,13,,,"Though I desire to go forth into the open quickly, I cannot do so because there is no path.",hayabaya to omote deyo to omoedomo   michi ga note wa deru ni deraren,はや／＼とをもてでよふとをもへとも,みちがのふてハでるにでられん
88,2,14,,,"Though I desire to open this path quickly, there is no place else to open it.",kono michi o hayaku tsukeyo to omoedomo   hoka naru toko de tsukeru toko nashi,このみちをはやくつけよとをもへとも,ほかなるとこでつけるとこなし
89,2,15,,,"If you are sincere in desiring this path to be, ponder over everything from your innermost heart.",kono michi o shinjitsu omou koto naraba   mune no uchi yori yorozu shiyan se,このみちをしんぢつをもう事ならば,むねのうちよりよろづしやんせ
90,2,16,,,What do you think this talk is about? I am hastening for the places where God's truth is conveyed.,kono hanashi nanno koto ya to omote iru   Kami no uchiwake basho sekikomu,このはなしなんの事やとをもている,神のうちわけばしよせきこむ
91,2,17,,,"When this path can be seen, even a little, all minds in the world will become spirited.",kono michi ga choto miekaketa koto naraba   sekai no kokoro mina isami deru,このみちが一寸みゑかけた事ならば,せかいの心みないさみてる
92,2,18,,,"Listen to whatever God says! If only the cleaning of the Residence is completed,",nani nitemo Kami no yu koto shikato kike   yashiki no soji deketa koto nara,なにゝても神のゆう事しかときけ,やしきのそふぢでけた事なら
93,2,19,,,"It will soon be seen. Without a moment to look aside, the dust will disappear as if you were dreaming.",mo mieru yokome furu ma mo nai hodoni   yume mita yoni hokori chiru zo ya,もふみへるよこめふるまないほどに,ゆめみたよふにほこりちるぞや
94,2,20,,,"When this dust is completely swept away, nothing will remain but universal salvation.",kono hokori sukiyaka harota koto naraba   ato wa yorozu no tasuke ichijo,このほこりすきやかはろた事ならば,あとハよろづのたすけ一ちよ
95,2,21,,,"Hereafter, I shall hasten the Service step by step, preparing only for universal salvation.",konosaki wa dandan Tsutome sekikonde   yorozu tasuke no moyo bakari o,このさきハたん／＼つとめせきこんで,よろづたすけのもよふばかりを
